{"format":"flyology.tla.result/2","verdict":"diverged","trace_sha256":"0123456789abcdef0123456789abcdef0123456789abcdef0123456789abcdef","compared_steps":1,"failure":{"step":1,"property":"tla-conformance","fingerprint":"outcome:Counter!Increment","detail":"observed outcome differs from the model after Counter!Increment","observed":{"outcome":{"accepted":false},"state":{"count":1}}}}
