{"format":"flyology.tla.result/2","verdict":"diverged","trace_sha256":"0123456789abcdef0123456789abcdef0123456789abcdef0123456789abcdef","compared_steps":1,"failure":{"step":1,"property":"tla-conformance","fingerprint":"state:Counter!Increment","detail":"observed semantic state differs from the model after Counter!Increment","observed":{"outcome":{"accepted":true},"state":{"count":99}}}}
